{
  "kind": "adrf-binding",
  "adrf": "0.1",
  "source": "0x00000000000000000000000000000000000e5c20",
  "sourceDescription": "ADRFServiceEscrow: obligation source and executor for its service calls",
  "policyId": "0x076505a99575bf1006c28609b6391f465246b7ded55d7a0d4eace05767a1b1b4",
  "scope": {
    "kind": "any-object-of-source"
  },
  "mode": "PRE_COMMIT",
  "authorizedEffects": [
    {
      "id": "0xe074020771795b0306209d2eb94e35a28bef8f823d7e65825aa3c0757e4626a9",
      "label": "refund",
      "authorityBasis": "the escrow holds the balances it moves"
    },
    {
      "id": "0x227ba5e1bfc45ac9adbe773aa1a71a3937453a1ff3a6bb1660ed7138f9936edc",
      "label": "fee-split",
      "authorityBasis": "the escrow holds the fee balance"
    }
  ],
  "executors": [
    {
      "account": "0x00000000000000000000000000000000000e5c20",
      "role": "source and executor"
    }
  ],
  "beneficiaries": [],
  "openChallenge": false,
  "downgradeOnClock": false,
  "validUntil": 0,
  "fundAuthorizations": [
    {
      "instrument": "escrow balances",
      "limit": "the amount of the call",
      "executor": "0x00000000000000000000000000000000000e5c20"
    }
  ],
  "identitiesNote": "the client and the provider are plain accounts; no agent identity, task token or swarm is required to open, deliver, charge or dispute a call",
  "clockRules": {
    "clock": "mode=timestamp (the registry clock)",
    "triggerEvents": [
      {
        "eventRef": "0x6522b1ac0c0c078f1fcc696b9cf72c59bb3624b7d2a9d82059b2f3832fd9973d",
        "label": "settlement of the call (obligation: payment, kind limit)",
        "obligationKind": 3
      },
      {
        "eventRef": "0xbc06ebe2b69400cc4d7163a14266e22c11bda70a17e5b6e491931df471c7c597",
        "label": "delivery of the call (obligation: delivery, kind result)",
        "obligationKind": 1
      }
    ],
    "adoptionDeadlineRule": "eventAt + the call dispute period; a case is admitted only if that deadline is at least maxTotalDuration + enactmentMargin away"
  },
  "noDecisionDisposition": {
    "ref": "0x59908be9e0c8081b785a87a2710908bb7da46e4e05ccc715447f3e81156b386e",
    "description": "balances stay where the call left them"
  }
}
